No.     Time           Source                Destination           Protocol Length Info
     59 5.848210       10.0.1.77             10.0.1.110            TCP      78     56204 → 194 [SYN] Seq=0 Win=65535 Len=0 MSS=1460 WS=32 TSval=1051186146 TSecr=0 SACK_PERM=1

Frame 59: 78 bytes on wire (624 bits), 78 bytes captured (624 bits) on interface en0, id 0
    Interface id: 0 (en0)
        Interface name: en0
        Interface description: Wi-Fi
    Encapsulation type: Ethernet (1)
    Arrival Time: May  3, 2020 11:19:08.257033000 PDT
    [Time shift for this packet: 0.000000000 seconds]
    Epoch Time: 1588529948.257033000 seconds
    [Time delta from previous captured frame: 0.141231000 seconds]
    [Time delta from previous displayed frame: 0.000000000 seconds]
    [Time since reference or first frame: 5.848210000 seconds]
    Frame Number: 59
    Frame Length: 78 bytes (624 bits)
    Capture Length: 78 bytes (624 bits)
    [Frame is marked: False]
    [Frame is ignored: False]
    [Protocols in frame: eth:ethertype:ip:tcp]
    [Coloring Rule Name: TCP SYN/FIN]
    [Coloring Rule String: tcp.flags & 0x02 || tcp.flags.fin == 1]
Ethernet II, Src: Apple_98:66:b3 (ac:bc:32:98:66:b3), Dst: Apple_76:3f:96 (00:30:65:76:3f:96)
    Destination: Apple_76:3f:96 (00:30:65:76:3f:96)
        Address: Apple_76:3f:96 (00:30:65:76:3f:96)
        .... ..0. .... .... .... .... = LG bit: Globally unique address (factory default)
        .... ...0 .... .... .... .... = IG bit: Individual address (unicast)
    Source: Apple_98:66:b3 (ac:bc:32:98:66:b3)
        Address: Apple_98:66:b3 (ac:bc:32:98:66:b3)
        .... ..0. .... .... .... .... = LG bit: Globally unique address (factory default)
        .... ...0 .... .... .... .... = IG bit: Individual address (unicast)
    Type: IPv4 (0x0800)
Internet Protocol Version 4, Src: 10.0.1.77, Dst: 10.0.1.110
    0100 .... = Version: 4
    .... 0101 = Header Length: 20 bytes (5)
    Differentiated Services Field: 0x00 (DSCP: CS0, ECN: Not-ECT)
        0000 00.. = Differentiated Services Codepoint: Default (0)
        .... ..00 = Explicit Congestion Notification: Not ECN-Capable Transport (0)
    Total Length: 64
    Identification: 0x537c (21372)
    Flags: 0x4000, Don't fragment
        0... .... .... .... = Reserved bit: Not set
        .1.. .... .... .... = Don't fragment: Set
        ..0. .... .... .... = More fragments: Not set
    Fragment offset: 0
    Time to live: 64
    Protocol: TCP (6)
    Header checksum: 0xd081 [validation disabled]
    [Header checksum status: Unverified]
    Source: 10.0.1.77
    Destination: 10.0.1.110
Transmission Control Protocol, Src Port: 56204, Dst Port: 194, Seq: 0, Len: 0
    Source Port: 56204
    Destination Port: 194
    [Stream index: 4]
    [TCP Segment Len: 0]
    Sequence number: 0    (relative sequence number)
    Sequence number (raw): 2301474874
    [Next sequence number: 1    (relative sequence number)]
    Acknowledgment number: 0
    Acknowledgment number (raw): 0
    1011 .... = Header Length: 44 bytes (11)
    Flags: 0x002 (SYN)
        000. .... .... = Reserved: Not set
        ...0 .... .... = Nonce: Not set
        .... 0... .... = Congestion Window Reduced (CWR): Not set
        .... .0.. .... = ECN-Echo: Not set
        .... ..0. .... = Urgent: Not set
        .... ...0 .... = Acknowledgment: Not set
        .... .... 0... = Push: Not set
        .... .... .0.. = Reset: Not set
        .... .... ..1. = Syn: Set
            [Expert Info (Chat/Sequence): Connection establish request (SYN): server port 194]
                [Connection establish request (SYN): server port 194]
                [Severity level: Chat]
                [Group: Sequence]
        .... .... ...0 = Fin: Not set
        [TCP Flags: ··········S·]
    Window size value: 65535
    [Calculated window size: 65535]
    Checksum: 0xf001 [unverified]
    [Checksum Status: Unverified]
    Urgent pointer: 0
    Options: (24 bytes), Maximum segment size, No-Operation (NOP), Window scale, No-Operation (NOP), No-Operation (NOP), Timestamps, SACK permitted, End of Option List (EOL)
        TCP Option - Maximum segment size: 1460 bytes
            Kind: Maximum Segment Size (2)
            Length: 4
            MSS Value: 1460
        TCP Option - No-Operation (NOP)
            Kind: No-Operation (1)
        TCP Option - Window scale: 5 (multiply by 32)
            Kind: Window Scale (3)
            Length: 3
            Shift count: 5
            [Multiplier: 32]
        TCP Option - No-Operation (NOP)
            Kind: No-Operation (1)
        TCP Option - No-Operation (NOP)
            Kind: No-Operation (1)
        TCP Option - Timestamps: TSval 1051186146, TSecr 0
            Kind: Time Stamp Option (8)
            Length: 10
            Timestamp value: 1051186146
            Timestamp echo reply: 0
        TCP Option - SACK permitted
            Kind: SACK Permitted (4)
            Length: 2
        TCP Option - End of Option List (EOL)
            Kind: End of Option List (0)
    [Timestamps]
        [Time since first frame in this TCP stream: 0.000000000 seconds]
        [Time since previous frame in this TCP stream: 0.000000000 seconds]

0000  00 30 65 76 3f 96 ac bc 32 98 66 b3 08 00 45 00   .0ev?...2.f...E.
0010  00 40 53 7c 40 00 40 06 d0 81 0a 00 01 4d 0a 00   .@S|@.@......M..
0020  01 6e db 8c 00 c2 89 2d b8 3a 00 00 00 00 b0 02   .n.....-.:......
0030  ff ff f0 01 00 00 02 04 05 b4 01 03 03 05 01 01   ................
0040  08 0a 3e a7 d3 e2 00 00 00 00 04 02 00 00         ..>...........

No.     Time           Source                Destination           Protocol Length Info
     60 5.851733       10.0.1.110            10.0.1.77             TCP      74     194 → 56204 [SYN, ACK] Seq=0 Ack=1 Win=32768 Len=0 MSS=1460 WS=1 TSval=649842904 TSecr=1051186146

Frame 60: 74 bytes on wire (592 bits), 74 bytes captured (592 bits) on interface en0, id 0
    Interface id: 0 (en0)
        Interface name: en0
        Interface description: Wi-Fi
    Encapsulation type: Ethernet (1)
    Arrival Time: May  3, 2020 11:19:08.260556000 PDT
    [Time shift for this packet: 0.000000000 seconds]
    Epoch Time: 1588529948.260556000 seconds
    [Time delta from previous captured frame: 0.003523000 seconds]
    [Time delta from previous displayed frame: 0.003523000 seconds]
    [Time since reference or first frame: 5.851733000 seconds]
    Frame Number: 60
    Frame Length: 74 bytes (592 bits)
    Capture Length: 74 bytes (592 bits)
    [Frame is marked: False]
    [Frame is ignored: False]
    [Protocols in frame: eth:ethertype:ip:tcp]
    [Coloring Rule Name: TCP SYN/FIN]
    [Coloring Rule String: tcp.flags & 0x02 || tcp.flags.fin == 1]
Ethernet II, Src: Apple_76:3f:96 (00:30:65:76:3f:96), Dst: Apple_98:66:b3 (ac:bc:32:98:66:b3)
    Destination: Apple_98:66:b3 (ac:bc:32:98:66:b3)
        Address: Apple_98:66:b3 (ac:bc:32:98:66:b3)
        .... ..0. .... .... .... .... = LG bit: Globally unique address (factory default)
        .... ...0 .... .... .... .... = IG bit: Individual address (unicast)
    Source: Apple_76:3f:96 (00:30:65:76:3f:96)
        Address: Apple_76:3f:96 (00:30:65:76:3f:96)
        .... ..0. .... .... .... .... = LG bit: Globally unique address (factory default)
        .... ...0 .... .... .... .... = IG bit: Individual address (unicast)
    Type: IPv4 (0x0800)
Internet Protocol Version 4, Src: 10.0.1.110, Dst: 10.0.1.77
    0100 .... = Version: 4
    .... 0101 = Header Length: 20 bytes (5)
    Differentiated Services Field: 0x00 (DSCP: CS0, ECN: Not-ECT)
        0000 00.. = Differentiated Services Codepoint: Default (0)
        .... ..00 = Explicit Congestion Notification: Not ECN-Capable Transport (0)
    Total Length: 60
    Identification: 0xdbac (56236)
    Flags: 0x4000, Don't fragment
        0... .... .... .... = Reserved bit: Not set
        .1.. .... .... .... = Don't fragment: Set
        ..0. .... .... .... = More fragments: Not set
    Fragment offset: 0
    Time to live: 255
    Protocol: TCP (6)
    Header checksum: 0x8954 [validation disabled]
    [Header checksum status: Unverified]
    Source: 10.0.1.110
    Destination: 10.0.1.77
Transmission Control Protocol, Src Port: 194, Dst Port: 56204, Seq: 0, Ack: 1, Len: 0
    Source Port: 194
    Destination Port: 56204
    [Stream index: 4]
    [TCP Segment Len: 0]
    Sequence number: 0    (relative sequence number)
    Sequence number (raw): 3201919192
    [Next sequence number: 1    (relative sequence number)]
    Acknowledgment number: 1    (relative ack number)
    Acknowledgment number (raw): 2301474875
    1010 .... = Header Length: 40 bytes (10)
    Flags: 0x012 (SYN, ACK)
        000. .... .... = Reserved: Not set
        ...0 .... .... = Nonce: Not set
        .... 0... .... = Congestion Window Reduced (CWR): Not set
        .... .0.. .... = ECN-Echo: Not set
        .... ..0. .... = Urgent: Not set
        .... ...1 .... = Acknowledgment: Set
        .... .... 0... = Push: Not set
        .... .... .0.. = Reset: Not set
        .... .... ..1. = Syn: Set
            [Expert Info (Chat/Sequence): Connection establish acknowledge (SYN+ACK): server port 194]
                [Connection establish acknowledge (SYN+ACK): server port 194]
                [Severity level: Chat]
                [Group: Sequence]
        .... .... ...0 = Fin: Not set
        [TCP Flags: ·······A··S·]
    Window size value: 32768
    [Calculated window size: 32768]
    Checksum: 0x65b4 [unverified]
    [Checksum Status: Unverified]
    Urgent pointer: 0
    Options: (20 bytes), Maximum segment size, Window scale, No-Operation (NOP), No-Operation (NOP), No-Operation (NOP), Timestamps
        TCP Option - Maximum segment size: 1460 bytes
            Kind: Maximum Segment Size (2)
            Length: 4
            MSS Value: 1460
        TCP Option - Window scale: 0 (multiply by 1)
            Kind: Window Scale (3)
            Length: 3
            Shift count: 0
            [Multiplier: 1]
        TCP Option - No-Operation (NOP)
            Kind: No-Operation (1)
        TCP Option - No-Operation (NOP)
            Kind: No-Operation (1)
        TCP Option - No-Operation (NOP)
            Kind: No-Operation (1)
        TCP Option - Timestamps: TSval 649842904, TSecr 1051186146
            Kind: Time Stamp Option (8)
            Length: 10
            Timestamp value: 649842904
            Timestamp echo reply: 1051186146
    [SEQ/ACK analysis]
        [This is an ACK to the segment in frame: 59]
        [The RTT to ACK the segment was: 0.003523000 seconds]
        [iRTT: 0.003593000 seconds]
    [Timestamps]
        [Time since first frame in this TCP stream: 0.003523000 seconds]
        [Time since previous frame in this TCP stream: 0.003523000 seconds]

0000  ac bc 32 98 66 b3 00 30 65 76 3f 96 08 00 45 00   ..2.f..0ev?...E.
0010  00 3c db ac 40 00 ff 06 89 54 0a 00 01 6e 0a 00   .<..@....T...n..
0020  01 4d 00 c2 db 8c be d9 68 d8 89 2d b8 3b a0 12   .M......h..-.;..
0030  80 00 65 b4 00 00 02 04 05 b4 03 03 00 01 01 01   ..e.............
0040  08 0a 26 bb d0 d8 3e a7 d3 e2                     ..&...>...

No.     Time           Source                Destination           Protocol Length Info
     61 5.851803       10.0.1.77             10.0.1.110            TCP      66     56204 → 194 [ACK] Seq=1 Ack=1 Win=131744 Len=0 TSval=1051186149 TSecr=649842904

Frame 61: 66 bytes on wire (528 bits), 66 bytes captured (528 bits) on interface en0, id 0
    Interface id: 0 (en0)
        Interface name: en0
        Interface description: Wi-Fi
    Encapsulation type: Ethernet (1)
    Arrival Time: May  3, 2020 11:19:08.260626000 PDT
    [Time shift for this packet: 0.000000000 seconds]
    Epoch Time: 1588529948.260626000 seconds
    [Time delta from previous captured frame: 0.000070000 seconds]
    [Time delta from previous displayed frame: 0.000070000 seconds]
    [Time since reference or first frame: 5.851803000 seconds]
    Frame Number: 61
    Frame Length: 66 bytes (528 bits)
    Capture Length: 66 bytes (528 bits)
    [Frame is marked: False]
    [Frame is ignored: False]
    [Protocols in frame: eth:ethertype:ip:tcp]
    [Coloring Rule Name: TCP]
    [Coloring Rule String: tcp]
Ethernet II, Src: Apple_98:66:b3 (ac:bc:32:98:66:b3), Dst: Apple_76:3f:96 (00:30:65:76:3f:96)
    Destination: Apple_76:3f:96 (00:30:65:76:3f:96)
        Address: Apple_76:3f:96 (00:30:65:76:3f:96)
        .... ..0. .... .... .... .... = LG bit: Globally unique address (factory default)
        .... ...0 .... .... .... .... = IG bit: Individual address (unicast)
    Source: Apple_98:66:b3 (ac:bc:32:98:66:b3)
        Address: Apple_98:66:b3 (ac:bc:32:98:66:b3)
        .... ..0. .... .... .... .... = LG bit: Globally unique address (factory default)
        .... ...0 .... .... .... .... = IG bit: Individual address (unicast)
    Type: IPv4 (0x0800)
Internet Protocol Version 4, Src: 10.0.1.77, Dst: 10.0.1.110
    0100 .... = Version: 4
    .... 0101 = Header Length: 20 bytes (5)
    Differentiated Services Field: 0x00 (DSCP: CS0, ECN: Not-ECT)
        0000 00.. = Differentiated Services Codepoint: Default (0)
        .... ..00 = Explicit Congestion Notification: Not ECN-Capable Transport (0)
    Total Length: 52
    Identification: 0x224d (8781)
    Flags: 0x4000, Don't fragment
        0... .... .... .... = Reserved bit: Not set
        .1.. .... .... .... = Don't fragment: Set
        ..0. .... .... .... = More fragments: Not set
    Fragment offset: 0
    Time to live: 64
    Protocol: TCP (6)
    Header checksum: 0x01bd [validation disabled]
    [Header checksum status: Unverified]
    Source: 10.0.1.77
    Destination: 10.0.1.110
Transmission Control Protocol, Src Port: 56204, Dst Port: 194, Seq: 1, Ack: 1, Len: 0
    Source Port: 56204
    Destination Port: 194
    [Stream index: 4]
    [TCP Segment Len: 0]
    Sequence number: 1    (relative sequence number)
    Sequence number (raw): 2301474875
    [Next sequence number: 1    (relative sequence number)]
    Acknowledgment number: 1    (relative ack number)
    Acknowledgment number (raw): 3201919193
    1000 .... = Header Length: 32 bytes (8)
    Flags: 0x010 (ACK)
        000. .... .... = Reserved: Not set
        ...0 .... .... = Nonce: Not set
        .... 0... .... = Congestion Window Reduced (CWR): Not set
        .... .0.. .... = ECN-Echo: Not set
        .... ..0. .... = Urgent: Not set
        .... ...1 .... = Acknowledgment: Set
        .... .... 0... = Push: Not set
        .... .... .0.. = Reset: Not set
        .... .... ..0. = Syn: Not set
        .... .... ...0 = Fin: Not set
        [TCP Flags: ·······A····]
    Window size value: 4117
    [Calculated window size: 131744]
    [Window size scaling factor: 32]
    Checksum: 0x0062 [unverified]
    [Checksum Status: Unverified]
    Urgent pointer: 0
    Options: (12 bytes), No-Operation (NOP), No-Operation (NOP), Timestamps
        TCP Option - No-Operation (NOP)
            Kind: No-Operation (1)
        TCP Option - No-Operation (NOP)
            Kind: No-Operation (1)
        TCP Option - Timestamps: TSval 1051186149, TSecr 649842904
            Kind: Time Stamp Option (8)
            Length: 10
            Timestamp value: 1051186149
            Timestamp echo reply: 649842904
    [SEQ/ACK analysis]
        [This is an ACK to the segment in frame: 60]
        [The RTT to ACK the segment was: 0.000070000 seconds]
        [iRTT: 0.003593000 seconds]
    [Timestamps]
        [Time since first frame in this TCP stream: 0.003593000 seconds]
        [Time since previous frame in this TCP stream: 0.000070000 seconds]

0000  00 30 65 76 3f 96 ac bc 32 98 66 b3 08 00 45 00   .0ev?...2.f...E.
0010  00 34 22 4d 40 00 40 06 01 bd 0a 00 01 4d 0a 00   .4"M@.@......M..
0020  01 6e db 8c 00 c2 89 2d b8 3b be d9 68 d9 80 10   .n.....-.;..h...
0030  10 15 00 62 00 00 01 01 08 0a 3e a7 d3 e5 26 bb   ...b......>...&.
0040  d0 d8                                             ..

No.     Time           Source                Destination           Protocol Length Info
     62 5.859770       10.0.1.77             10.0.1.110            TCP      86     56204 → 194 [PSH, ACK] Seq=1 Ack=1 Win=131744 Len=20 TSval=1051186156 TSecr=649842904

Frame 62: 86 bytes on wire (688 bits), 86 bytes captured (688 bits) on interface en0, id 0
    Interface id: 0 (en0)
        Interface name: en0
        Interface description: Wi-Fi
    Encapsulation type: Ethernet (1)
    Arrival Time: May  3, 2020 11:19:08.268593000 PDT
    [Time shift for this packet: 0.000000000 seconds]
    Epoch Time: 1588529948.268593000 seconds
    [Time delta from previous captured frame: 0.007967000 seconds]
    [Time delta from previous displayed frame: 0.007967000 seconds]
    [Time since reference or first frame: 5.859770000 seconds]
    Frame Number: 62
    Frame Length: 86 bytes (688 bits)
    Capture Length: 86 bytes (688 bits)
    [Frame is marked: False]
    [Frame is ignored: False]
    [Protocols in frame: eth:ethertype:ip:tcp:data]
    [Coloring Rule Name: TCP]
    [Coloring Rule String: tcp]
Ethernet II, Src: Apple_98:66:b3 (ac:bc:32:98:66:b3), Dst: Apple_76:3f:96 (00:30:65:76:3f:96)
    Destination: Apple_76:3f:96 (00:30:65:76:3f:96)
        Address: Apple_76:3f:96 (00:30:65:76:3f:96)
        .... ..0. .... .... .... .... = LG bit: Globally unique address (factory default)
        .... ...0 .... .... .... .... = IG bit: Individual address (unicast)
    Source: Apple_98:66:b3 (ac:bc:32:98:66:b3)
        Address: Apple_98:66:b3 (ac:bc:32:98:66:b3)
        .... ..0. .... .... .... .... = LG bit: Globally unique address (factory default)
        .... ...0 .... .... .... .... = IG bit: Individual address (unicast)
    Type: IPv4 (0x0800)
Internet Protocol Version 4, Src: 10.0.1.77, Dst: 10.0.1.110
    0100 .... = Version: 4
    .... 0101 = Header Length: 20 bytes (5)
    Differentiated Services Field: 0x00 (DSCP: CS0, ECN: Not-ECT)
        0000 00.. = Differentiated Services Codepoint: Default (0)
        .... ..00 = Explicit Congestion Notification: Not ECN-Capable Transport (0)
    Total Length: 72
    Identification: 0xad59 (44377)
    Flags: 0x4000, Don't fragment
        0... .... .... .... = Reserved bit: Not set
        .1.. .... .... .... = Don't fragment: Set
        ..0. .... .... .... = More fragments: Not set
    Fragment offset: 0
    Time to live: 64
    Protocol: TCP (6)
    Header checksum: 0x769c [validation disabled]
    [Header checksum status: Unverified]
    Source: 10.0.1.77
    Destination: 10.0.1.110
Transmission Control Protocol, Src Port: 56204, Dst Port: 194, Seq: 1, Ack: 1, Len: 20
    Source Port: 56204
    Destination Port: 194
    [Stream index: 4]
    [TCP Segment Len: 20]
    Sequence number: 1    (relative sequence number)
    Sequence number (raw): 2301474875
    [Next sequence number: 21    (relative sequence number)]
    Acknowledgment number: 1    (relative ack number)
    Acknowledgment number (raw): 3201919193
    1000 .... = Header Length: 32 bytes (8)
    Flags: 0x018 (PSH, ACK)
        000. .... .... = Reserved: Not set
        ...0 .... .... = Nonce: Not set
        .... 0... .... = Congestion Window Reduced (CWR): Not set
        .... .0.. .... = ECN-Echo: Not set
        .... ..0. .... = Urgent: Not set
        .... ...1 .... = Acknowledgment: Set
        .... .... 1... = Push: Set
        .... .... .0.. = Reset: Not set
        .... .... ..0. = Syn: Not set
        .... .... ...0 = Fin: Not set
        [TCP Flags: ·······AP···]
    Window size value: 4117
    [Calculated window size: 131744]
    [Window size scaling factor: 32]
    Checksum: 0x2795 [unverified]
    [Checksum Status: Unverified]
    Urgent pointer: 0
    Options: (12 bytes), No-Operation (NOP), No-Operation (NOP), Timestamps
        TCP Option - No-Operation (NOP)
            Kind: No-Operation (1)
        TCP Option - No-Operation (NOP)
            Kind: No-Operation (1)
        TCP Option - Timestamps: TSval 1051186156, TSecr 649842904
            Kind: Time Stamp Option (8)
            Length: 10
            Timestamp value: 1051186156
            Timestamp echo reply: 649842904
    [SEQ/ACK analysis]
        [iRTT: 0.003593000 seconds]
        [Bytes in flight: 20]
        [Bytes sent since last PSH flag: 20]
    [Timestamps]
        [Time since first frame in this TCP stream: 0.011560000 seconds]
        [Time since previous frame in this TCP stream: 0.007967000 seconds]
    TCP payload (20 bytes)
Data (20 bytes)
    Data: 4e4f4e43203a757365723d225359534f50220d0a
    [Length: 20]

0000  00 30 65 76 3f 96 ac bc 32 98 66 b3 08 00 45 00   .0ev?...2.f...E.
0010  00 48 ad 59 40 00 40 06 76 9c 0a 00 01 4d 0a 00   .H.Y@.@.v....M..
0020  01 6e db 8c 00 c2 89 2d b8 3b be d9 68 d9 80 18   .n.....-.;..h...
0030  10 15 27 95 00 00 01 01 08 0a 3e a7 d3 ec 26 bb   ..'.......>...&.
0040  d0 d8 4e 4f 4e 43 20 3a 75 73 65 72 3d 22 53 59   ..NONC :user="SY
0050  53 4f 50 22 0d 0a                                 SOP"..

No.     Time           Source                Destination           Protocol Length Info
     63 5.897798       10.0.1.110            10.0.1.77             TCP      118    194 → 56204 [PSH, ACK] Seq=1 Ack=21 Win=32768 Len=52 TSval=649842952 TSecr=1051186156

Frame 63: 118 bytes on wire (944 bits), 118 bytes captured (944 bits) on interface en0, id 0
    Interface id: 0 (en0)
        Interface name: en0
        Interface description: Wi-Fi
    Encapsulation type: Ethernet (1)
    Arrival Time: May  3, 2020 11:19:08.306621000 PDT
    [Time shift for this packet: 0.000000000 seconds]
    Epoch Time: 1588529948.306621000 seconds
    [Time delta from previous captured frame: 0.038028000 seconds]
    [Time delta from previous displayed frame: 0.038028000 seconds]
    [Time since reference or first frame: 5.897798000 seconds]
    Frame Number: 63
    Frame Length: 118 bytes (944 bits)
    Capture Length: 118 bytes (944 bits)
    [Frame is marked: False]
    [Frame is ignored: False]
    [Protocols in frame: eth:ethertype:ip:tcp:data]
    [Coloring Rule Name: TCP]
    [Coloring Rule String: tcp]
Ethernet II, Src: Apple_76:3f:96 (00:30:65:76:3f:96), Dst: Apple_98:66:b3 (ac:bc:32:98:66:b3)
    Destination: Apple_98:66:b3 (ac:bc:32:98:66:b3)
        Address: Apple_98:66:b3 (ac:bc:32:98:66:b3)
        .... ..0. .... .... .... .... = LG bit: Globally unique address (factory default)
        .... ...0 .... .... .... .... = IG bit: Individual address (unicast)
    Source: Apple_76:3f:96 (00:30:65:76:3f:96)
        Address: Apple_76:3f:96 (00:30:65:76:3f:96)
        .... ..0. .... .... .... .... = LG bit: Globally unique address (factory default)
        .... ...0 .... .... .... .... = IG bit: Individual address (unicast)
    Type: IPv4 (0x0800)
Internet Protocol Version 4, Src: 10.0.1.110, Dst: 10.0.1.77
    0100 .... = Version: 4
    .... 0101 = Header Length: 20 bytes (5)
    Differentiated Services Field: 0x00 (DSCP: CS0, ECN: Not-ECT)
        0000 00.. = Differentiated Services Codepoint: Default (0)
        .... ..00 = Explicit Congestion Notification: Not ECN-Capable Transport (0)
    Total Length: 104
    Identification: 0xdbad (56237)
    Flags: 0x4000, Don't fragment
        0... .... .... .... = Reserved bit: Not set
        .1.. .... .... .... = Don't fragment: Set
        ..0. .... .... .... = More fragments: Not set
    Fragment offset: 0
    Time to live: 255
    Protocol: TCP (6)
    Header checksum: 0x8927 [validation disabled]
    [Header checksum status: Unverified]
    Source: 10.0.1.110
    Destination: 10.0.1.77
Transmission Control Protocol, Src Port: 194, Dst Port: 56204, Seq: 1, Ack: 21, Len: 52
    Source Port: 194
    Destination Port: 56204
    [Stream index: 4]
    [TCP Segment Len: 52]
    Sequence number: 1    (relative sequence number)
    Sequence number (raw): 3201919193
    [Next sequence number: 53    (relative sequence number)]
    Acknowledgment number: 21    (relative ack number)
    Acknowledgment number (raw): 2301474895
    1000 .... = Header Length: 32 bytes (8)
    Flags: 0x018 (PSH, ACK)
        000. .... .... = Reserved: Not set
        ...0 .... .... = Nonce: Not set
        .... 0... .... = Congestion Window Reduced (CWR): Not set
        .... .0.. .... = ECN-Echo: Not set
        .... ..0. .... = Urgent: Not set
        .... ...1 .... = Acknowledgment: Set
        .... .... 1... = Push: Set
        .... .... .0.. = Reset: Not set
        .... .... ..0. = Syn: Not set
        .... .... ...0 = Fin: Not set
        [TCP Flags: ·······AP···]
    Window size value: 32768
    [Calculated window size: 32768]
    [Window size scaling factor: 1]
    Checksum: 0xa482 [unverified]
    [Checksum Status: Unverified]
    Urgent pointer: 0
    Options: (12 bytes), No-Operation (NOP), No-Operation (NOP), Timestamps
        TCP Option - No-Operation (NOP)
            Kind: No-Operation (1)
        TCP Option - No-Operation (NOP)
            Kind: No-Operation (1)
        TCP Option - Timestamps: TSval 649842952, TSecr 1051186156
            Kind: Time Stamp Option (8)
            Length: 10
            Timestamp value: 649842952
            Timestamp echo reply: 1051186156
    [SEQ/ACK analysis]
        [This is an ACK to the segment in frame: 62]
        [The RTT to ACK the segment was: 0.038028000 seconds]
        [iRTT: 0.003593000 seconds]
        [Bytes in flight: 52]
        [Bytes sent since last PSH flag: 52]
    [Timestamps]
        [Time since first frame in this TCP stream: 0.049588000 seconds]
        [Time since previous frame in this TCP stream: 0.038028000 seconds]
    TCP payload (52 bytes)
Data (52 bytes)
    Data: 333030203a646967657374207265616c6d3d2244656d6f43…
    [Length: 52]

0000  ac bc 32 98 66 b3 00 30 65 76 3f 96 08 00 45 00   ..2.f..0ev?...E.
0010  00 68 db ad 40 00 ff 06 89 27 0a 00 01 6e 0a 00   .h..@....'...n..
0020  01 4d 00 c2 db 8c be d9 68 d9 89 2d b8 4f 80 18   .M......h..-.O..
0030  80 00 a4 82 00 00 01 01 08 0a 26 bb d1 08 3e a7   ..........&...>.
0040  d3 ec 33 30 30 20 3a 64 69 67 65 73 74 20 72 65   ..300 :digest re
0050  61 6c 6d 3d 22 44 65 6d 6f 43 65 6e 74 72 61 6c   alm="DemoCentral
0060  22 2c 6e 6f 6e 63 65 3d 22 32 30 31 39 35 30 35   ",nonce="2019505
0070  34 35 36 22 0d 0a                                 456"..

No.     Time           Source                Destination           Protocol Length Info
     64 5.897877       10.0.1.77             10.0.1.110            TCP      66     56204 → 194 [ACK] Seq=21 Ack=53 Win=131712 Len=0 TSval=1051186194 TSecr=649842952

Frame 64: 66 bytes on wire (528 bits), 66 bytes captured (528 bits) on interface en0, id 0
    Interface id: 0 (en0)
        Interface name: en0
        Interface description: Wi-Fi
    Encapsulation type: Ethernet (1)
    Arrival Time: May  3, 2020 11:19:08.306700000 PDT
    [Time shift for this packet: 0.000000000 seconds]
    Epoch Time: 1588529948.306700000 seconds
    [Time delta from previous captured frame: 0.000079000 seconds]
    [Time delta from previous displayed frame: 0.000079000 seconds]
    [Time since reference or first frame: 5.897877000 seconds]
    Frame Number: 64
    Frame Length: 66 bytes (528 bits)
    Capture Length: 66 bytes (528 bits)
    [Frame is marked: False]
    [Frame is ignored: False]
    [Protocols in frame: eth:ethertype:ip:tcp]
    [Coloring Rule Name: TCP]
    [Coloring Rule String: tcp]
Ethernet II, Src: Apple_98:66:b3 (ac:bc:32:98:66:b3), Dst: Apple_76:3f:96 (00:30:65:76:3f:96)
    Destination: Apple_76:3f:96 (00:30:65:76:3f:96)
        Address: Apple_76:3f:96 (00:30:65:76:3f:96)
        .... ..0. .... .... .... .... = LG bit: Globally unique address (factory default)
        .... ...0 .... .... .... .... = IG bit: Individual address (unicast)
    Source: Apple_98:66:b3 (ac:bc:32:98:66:b3)
        Address: Apple_98:66:b3 (ac:bc:32:98:66:b3)
        .... ..0. .... .... .... .... = LG bit: Globally unique address (factory default)
        .... ...0 .... .... .... .... = IG bit: Individual address (unicast)
    Type: IPv4 (0x0800)
Internet Protocol Version 4, Src: 10.0.1.77, Dst: 10.0.1.110
    0100 .... = Version: 4
    .... 0101 = Header Length: 20 bytes (5)
    Differentiated Services Field: 0x00 (DSCP: CS0, ECN: Not-ECT)
        0000 00.. = Differentiated Services Codepoint: Default (0)
        .... ..00 = Explicit Congestion Notification: Not ECN-Capable Transport (0)
    Total Length: 52
    Identification: 0x00e2 (226)
    Flags: 0x4000, Don't fragment
        0... .... .... .... = Reserved bit: Not set
        .1.. .... .... .... = Don't fragment: Set
        ..0. .... .... .... = More fragments: Not set
    Fragment offset: 0
    Time to live: 64
    Protocol: TCP (6)
    Header checksum: 0x2328 [validation disabled]
    [Header checksum status: Unverified]
    Source: 10.0.1.77
    Destination: 10.0.1.110
Transmission Control Protocol, Src Port: 56204, Dst Port: 194, Seq: 21, Ack: 53, Len: 0
    Source Port: 56204
    Destination Port: 194
    [Stream index: 4]
    [TCP Segment Len: 0]
    Sequence number: 21    (relative sequence number)
    Sequence number (raw): 2301474895
    [Next sequence number: 21    (relative sequence number)]
    Acknowledgment number: 53    (relative ack number)
    Acknowledgment number (raw): 3201919245
    1000 .... = Header Length: 32 bytes (8)
    Flags: 0x010 (ACK)
        000. .... .... = Reserved: Not set
        ...0 .... .... = Nonce: Not set
        .... 0... .... = Congestion Window Reduced (CWR): Not set
        .... .0.. .... = ECN-Echo: Not set
        .... ..0. .... = Urgent: Not set
        .... ...1 .... = Acknowledgment: Set
        .... .... 0... = Push: Not set
        .... .... .0.. = Reset: Not set
        .... .... ..0. = Syn: Not set
        .... .... ...0 = Fin: Not set
        [TCP Flags: ·······A····]
    Window size value: 4116
    [Calculated window size: 131712]
    [Window size scaling factor: 32]
    Checksum: 0xffbd [unverified]
    [Checksum Status: Unverified]
    Urgent pointer: 0
    Options: (12 bytes), No-Operation (NOP), No-Operation (NOP), Timestamps
        TCP Option - No-Operation (NOP)
            Kind: No-Operation (1)
        TCP Option - No-Operation (NOP)
            Kind: No-Operation (1)
        TCP Option - Timestamps: TSval 1051186194, TSecr 649842952
            Kind: Time Stamp Option (8)
            Length: 10
            Timestamp value: 1051186194
            Timestamp echo reply: 649842952
    [SEQ/ACK analysis]
        [This is an ACK to the segment in frame: 63]
        [The RTT to ACK the segment was: 0.000079000 seconds]
        [iRTT: 0.003593000 seconds]
    [Timestamps]
        [Time since first frame in this TCP stream: 0.049667000 seconds]
        [Time since previous frame in this TCP stream: 0.000079000 seconds]

0000  00 30 65 76 3f 96 ac bc 32 98 66 b3 08 00 45 00   .0ev?...2.f...E.
0010  00 34 00 e2 40 00 40 06 23 28 0a 00 01 4d 0a 00   .4..@.@.#(...M..
0020  01 6e db 8c 00 c2 89 2d b8 4f be d9 69 0d 80 10   .n.....-.O..i...
0030  10 14 ff bd 00 00 01 01 08 0a 3e a7 d4 12 26 bb   ..........>...&.
0040  d1 08                                             ..

No.     Time           Source                Destination           Protocol Length Info
     65 5.923030       10.0.1.77             10.0.1.110            TCP      188    56204 → 194 [PSH, ACK] Seq=21 Ack=53 Win=131712 Len=122 TSval=1051186219 TSecr=649842952

Frame 65: 188 bytes on wire (1504 bits), 188 bytes captured (1504 bits) on interface en0, id 0
    Interface id: 0 (en0)
        Interface name: en0
        Interface description: Wi-Fi
    Encapsulation type: Ethernet (1)
    Arrival Time: May  3, 2020 11:19:08.331853000 PDT
    [Time shift for this packet: 0.000000000 seconds]
    Epoch Time: 1588529948.331853000 seconds
    [Time delta from previous captured frame: 0.025153000 seconds]
    [Time delta from previous displayed frame: 0.025153000 seconds]
    [Time since reference or first frame: 5.923030000 seconds]
    Frame Number: 65
    Frame Length: 188 bytes (1504 bits)
    Capture Length: 188 bytes (1504 bits)
    [Frame is marked: False]
    [Frame is ignored: False]
    [Protocols in frame: eth:ethertype:ip:tcp:data]
    [Coloring Rule Name: TCP]
    [Coloring Rule String: tcp]
Ethernet II, Src: Apple_98:66:b3 (ac:bc:32:98:66:b3), Dst: Apple_76:3f:96 (00:30:65:76:3f:96)
    Destination: Apple_76:3f:96 (00:30:65:76:3f:96)
        Address: Apple_76:3f:96 (00:30:65:76:3f:96)
        .... ..0. .... .... .... .... = LG bit: Globally unique address (factory default)
        .... ...0 .... .... .... .... = IG bit: Individual address (unicast)
    Source: Apple_98:66:b3 (ac:bc:32:98:66:b3)
        Address: Apple_98:66:b3 (ac:bc:32:98:66:b3)
        .... ..0. .... .... .... .... = LG bit: Globally unique address (factory default)
        .... ...0 .... .... .... .... = IG bit: Individual address (unicast)
    Type: IPv4 (0x0800)
Internet Protocol Version 4, Src: 10.0.1.77, Dst: 10.0.1.110
    0100 .... = Version: 4
    .... 0101 = Header Length: 20 bytes (5)
    Differentiated Services Field: 0x00 (DSCP: CS0, ECN: Not-ECT)
        0000 00.. = Differentiated Services Codepoint: Default (0)
        .... ..00 = Explicit Congestion Notification: Not ECN-Capable Transport (0)
    Total Length: 174
    Identification: 0xa6b0 (42672)
    Flags: 0x4000, Don't fragment
        0... .... .... .... = Reserved bit: Not set
        .1.. .... .... .... = Don't fragment: Set
        ..0. .... .... .... = More fragments: Not set
    Fragment offset: 0
    Time to live: 64
    Protocol: TCP (6)
    Header checksum: 0x7cdf [validation disabled]
    [Header checksum status: Unverified]
    Source: 10.0.1.77
    Destination: 10.0.1.110
Transmission Control Protocol, Src Port: 56204, Dst Port: 194, Seq: 21, Ack: 53, Len: 122
    Source Port: 56204
    Destination Port: 194
    [Stream index: 4]
    [TCP Segment Len: 122]
    Sequence number: 21    (relative sequence number)
    Sequence number (raw): 2301474895
    [Next sequence number: 143    (relative sequence number)]
    Acknowledgment number: 53    (relative ack number)
    Acknowledgment number (raw): 3201919245
    1000 .... = Header Length: 32 bytes (8)
    Flags: 0x018 (PSH, ACK)
        000. .... .... = Reserved: Not set
        ...0 .... .... = Nonce: Not set
        .... 0... .... = Congestion Window Reduced (CWR): Not set
        .... .0.. .... = ECN-Echo: Not set
        .... ..0. .... = Urgent: Not set
        .... ...1 .... = Acknowledgment: Set
        .... .... 1... = Push: Set
        .... .... .0.. = Reset: Not set
        .... .... ..0. = Syn: Not set
        .... .... ...0 = Fin: Not set
        [TCP Flags: ·······AP···]
    Window size value: 4116
    [Calculated window size: 131712]
    [Window size scaling factor: 32]
    Checksum: 0xa619 [unverified]
    [Checksum Status: Unverified]
    Urgent pointer: 0
    Options: (12 bytes), No-Operation (NOP), No-Operation (NOP), Timestamps
        TCP Option - No-Operation (NOP)
            Kind: No-Operation (1)
        TCP Option - No-Operation (NOP)
            Kind: No-Operation (1)
        TCP Option - Timestamps: TSval 1051186219, TSecr 649842952
            Kind: Time Stamp Option (8)
            Length: 10
            Timestamp value: 1051186219
            Timestamp echo reply: 649842952
    [SEQ/ACK analysis]
        [iRTT: 0.003593000 seconds]
        [Bytes in flight: 122]
        [Bytes sent since last PSH flag: 122]
    [Timestamps]
        [Time since first frame in this TCP stream: 0.074820000 seconds]
        [Time since previous frame in this TCP stream: 0.025153000 seconds]
    TCP payload (122 bytes)
Data (122 bytes)
    Data: 41555448203a64696765737420757365726e616d653d2253…
    [Length: 122]

0000  00 30 65 76 3f 96 ac bc 32 98 66 b3 08 00 45 00   .0ev?...2.f...E.
0010  00 ae a6 b0 40 00 40 06 7c df 0a 00 01 4d 0a 00   ....@.@.|....M..
0020  01 6e db 8c 00 c2 89 2d b8 4f be d9 69 0d 80 18   .n.....-.O..i...
0030  10 14 a6 19 00 00 01 01 08 0a 3e a7 d4 2b 26 bb   ..........>..+&.
0040  d1 08 41 55 54 48 20 3a 64 69 67 65 73 74 20 75   ..AUTH :digest u
0050  73 65 72 6e 61 6d 65 3d 22 53 59 53 4f 50 22 2c   sername="SYSOP",
0060  72 65 61 6c 6d 3d 22 44 65 6d 6f 43 65 6e 74 72   realm="DemoCentr
0070  61 6c 22 2c 6e 6f 6e 63 65 3d 22 32 30 31 39 35   al",nonce="20195
0080  30 35 34 35 36 22 2c 75 72 69 3d 22 2f 22 2c 72   05456",uri="/",r
0090  65 73 70 6f 6e 73 65 3d 22 66 36 37 63 64 30 64   esponse="f67cd0d
00a0  36 31 64 66 39 37 36 65 37 64 37 30 33 38 63 32   61df976e7d7038c2
00b0  32 63 63 33 66 39 65 66 61 22 0d 0a               2cc3f9efa"..

No.     Time           Source                Destination           Protocol Length Info
     66 5.943794       10.0.1.110            10.0.1.77             TCP      71     194 → 56204 [PSH, ACK] Seq=53 Ack=143 Win=32768 Len=5 TSval=649842998 TSecr=1051186219

Frame 66: 71 bytes on wire (568 bits), 71 bytes captured (568 bits) on interface en0, id 0
    Interface id: 0 (en0)
        Interface name: en0
        Interface description: Wi-Fi
    Encapsulation type: Ethernet (1)
    Arrival Time: May  3, 2020 11:19:08.352617000 PDT
    [Time shift for this packet: 0.000000000 seconds]
    Epoch Time: 1588529948.352617000 seconds
    [Time delta from previous captured frame: 0.020764000 seconds]
    [Time delta from previous displayed frame: 0.020764000 seconds]
    [Time since reference or first frame: 5.943794000 seconds]
    Frame Number: 66
    Frame Length: 71 bytes (568 bits)
    Capture Length: 71 bytes (568 bits)
    [Frame is marked: False]
    [Frame is ignored: False]
    [Protocols in frame: eth:ethertype:ip:tcp:data]
    [Coloring Rule Name: TCP]
    [Coloring Rule String: tcp]
Ethernet II, Src: Apple_76:3f:96 (00:30:65:76:3f:96), Dst: Apple_98:66:b3 (ac:bc:32:98:66:b3)
    Destination: Apple_98:66:b3 (ac:bc:32:98:66:b3)
        Address: Apple_98:66:b3 (ac:bc:32:98:66:b3)
        .... ..0. .... .... .... .... = LG bit: Globally unique address (factory default)
        .... ...0 .... .... .... .... = IG bit: Individual address (unicast)
    Source: Apple_76:3f:96 (00:30:65:76:3f:96)
        Address: Apple_76:3f:96 (00:30:65:76:3f:96)
        .... ..0. .... .... .... .... = LG bit: Globally unique address (factory default)
        .... ...0 .... .... .... .... = IG bit: Individual address (unicast)
    Type: IPv4 (0x0800)
Internet Protocol Version 4, Src: 10.0.1.110, Dst: 10.0.1.77
    0100 .... = Version: 4
    .... 0101 = Header Length: 20 bytes (5)
    Differentiated Services Field: 0x00 (DSCP: CS0, ECN: Not-ECT)
        0000 00.. = Differentiated Services Codepoint: Default (0)
        .... ..00 = Explicit Congestion Notification: Not ECN-Capable Transport (0)
    Total Length: 57
    Identification: 0xdbae (56238)
    Flags: 0x4000, Don't fragment
        0... .... .... .... = Reserved bit: Not set
        .1.. .... .... .... = Don't fragment: Set
        ..0. .... .... .... = More fragments: Not set
    Fragment offset: 0
    Time to live: 255
    Protocol: TCP (6)
    Header checksum: 0x8955 [validation disabled]
    [Header checksum status: Unverified]
    Source: 10.0.1.110
    Destination: 10.0.1.77
Transmission Control Protocol, Src Port: 194, Dst Port: 56204, Seq: 53, Ack: 143, Len: 5
    Source Port: 194
    Destination Port: 56204
    [Stream index: 4]
    [TCP Segment Len: 5]
    Sequence number: 53    (relative sequence number)
    Sequence number (raw): 3201919245
    [Next sequence number: 58    (relative sequence number)]
    Acknowledgment number: 143    (relative ack number)
    Acknowledgment number (raw): 2301475017
    1000 .... = Header Length: 32 bytes (8)
    Flags: 0x018 (PSH, ACK)
        000. .... .... = Reserved: Not set
        ...0 .... .... = Nonce: Not set
        .... 0... .... = Congestion Window Reduced (CWR): Not set
        .... .0.. .... = ECN-Echo: Not set
        .... ..0. .... = Urgent: Not set
        .... ...1 .... = Acknowledgment: Set
        .... .... 1... = Push: Set
        .... .... .0.. = Reset: Not set
        .... .... ..0. = Syn: Not set
